,español,ingles
1380, veo que les hace falta una conexion  entre donde estan y donde quisieran ir.   !-Ese es un sueño magnifico!  digo,I see that they need a connection between where they are and where they would like to go. - That is a magnificent dream! I say
1381, en respuesta a un cuadro  que me han pintado. Luego pregunto:   Como vas a lograrlo?   Algunos no tienen idea. Eso puede estat bien si,in response to a painting that I have been painted. Then I ask: How are you going to achieve it? Some have no idea That can be fine if
1382, como sucedio en  el caso de Mike Hyatt (en el capitulo 2),as it happened in the case of Mike Hyatt (in chapter 2)
1383, su sueño es nuevo y apenas  han empezado a ttabajar en la estrategia. No obstante,his dream is new and they have just begun to work on strategy. However
1384, si les veo seis  meses,If I see you six months
1385, un año o cinco años despues y aun no tienen una estrategia,a year or five years later and still do not have a strategy
1386,  estan en problemas. Han fracasado en la Transicion de soñadores a  ejecutores.  No existe poder magico en tener un sueño. Sencillamente no  puedes quedarte espetandolo. Tienes que ttabajar en buscarlo,They are in trouble. They have failed in the transition from dreamers to executors. There is no magic power in having a dream. You simply can not stay spitting. You have to work on looking for it
1387, y  tienes que tener una estrategia que te de direccion y enfoque para  trabajar. La razon por la cual escribi este libro es para darte una  oportunidad realista de alcanzar tu sueño. Recuerda,and you have to have a strategy that gives you direction and focus to work. The reason why I wrote this book is to give you a realistic opportunity to achieve your dream. Remember
1388, cuantas mas  respuestas afirmativas des a las diez preguntas acerca de el,The more affirmative answers you give to the ten questions about the
1389, mejores  seran las probabilidades de que lo logres. La pregunta del camino es  el eje central de toda la idea. Si tienes una estrategia para alcanzar tu  sueño,the better the chances that you will achieve it. The road question is the central axis of the whole idea. If you have a strategy to achieve your dream
1390, tienes una oportunidad excelente de lograrlo. Si no,You have an excellent opportunity to achieve it. If not
1391, es como  si estuvieras viviendo en la Tierra de la Fantasia.  | JVo existe poder magico en tener un sueño. Sencillamente no j  ij puedes quedarte esperandolo. Tienes que trabajar en buscarlo. || V \' $  105  poderosa; ahora tiene 63 años. Ya adquirio fama como fundador del Laboratorio de Medios de MIT,It's as if you were living in the Land of Fantasy. | There is magic power in having a dream. Simply not j ij you can stay waiting for it. You have to work in looking for it. || V \ '$ 105 powerful; Now he is 63 years old. He has already gained fame as the founder of the MIT Media Lab
1392, pero en lugar de recostarse,but instead of lying down
1393, rela- jarse y disfrutar de la vida,relax and enjoy life
1394, ha decidido levantarse y disfrutarla de manera diferente: trabajando duro por un sueño capaz de cambiar el mundo. 5 Al momento de escribir estas lineas,He has decided to get up and enjoy it in a different way: working hard for a dream capable of changing the world. 5 At the time of writing these lines
1395, aun no ha logrado con- vertirlo en realidad,has not yet managed to turn it into reality
1396, mas aun rrabaja en ello. En el 2007 se inicio una produccion en masa de computadoras en el mes de noviembre. En diciembre,"but still work on it. In 2007, a mass production of computers began in November. In December"
1397, Peru hizo un pedido de 260,Peru placed an order for 260
1398,000 unidades. 6 Otras 190,000 units. 6 Other 190
1399,000 unidades fueron compradas a traves de un programa en Estados Unidos en el cual los compradores podian obtener una XO para si mismos y donar otra a un niño en un pais en desarrollo. En los proximos años,000 units were purchased through a program in the United States in which buyers could obtain an XO for themselves and donate another to a child in a developing country. In the next years
1400, tendremos que observar si Negroponte y OLPC son capaces de desarrollar e implementar una estrategia que sea tan grande como lo es su sueño.   CUAL ES TU PLAN?   Tienes una estrategia para alcanzar tu sueño?  Como respondes a la pregunta del camino?  Estas tratando de forjarlo,We will have to see if Negroponte and OLPC are able to develop and implement a strategy that is as great as their dream is. WHAT IS YOUR PLAN? Do you have a strategy to achieve your dream? How do you answer the road question? You are trying to forge it
1401, o estas esperando a que tu hada madrina te saque de aprietos? Si eres como algunos de los personajes animados en las peliculas de Disney,or are you waiting for your fairy godmother to get you out of trouble? If you're like some of the animated characters in Disney movies
1402, si haces un deseo al ver una estrella fugaz y sencillamente esperas a que se convierta en realidad,if you make a wish to see a shooting star and simply wait for it to become a reality
1403, !-quedaras decepcionado! Es triste ver personas sin sueños. Es igualmente triste cuando tienen sueños pero carecen de estrategia para alcanzarlos,You will be disappointed! It is sad to see people without dreams. It is equally sad when they have dreams but lack strategy to achieve them
1404, o no tienen manera de subir hasta ellos o de edificar un fundamento bajo ellos. A traves de los años,or they have no way to go up to them or to build a foundation under them. Through the years
1405, he tratado de ser un levantador de sueños. Por  La pregunta del camino:  Tengo una estrategia para alcanzar mi sueño?  107  !-Vive tu sueño!  108  Un amigo recientemente me dio a conocer los resultados de un estudio realizado en el 2005 y publicado por ThinkTQ,I have tried to be a lifter of dreams. By The question of the way: I have a strategy to achieve my dream? 107! -Live your dream! 108 A friend recently gave me the results of a study conducted in 2005 and published by ThinkTQ
1406, una orga- nizacion dedicada a la capacitacion y la publicacion. Ilustraba la poca frecuencia con la cual los individuos desarrollan estrategias para lograr sus sueños. Esto es lo que revelo el estudio acerca de las personas examinadas:  <t> 26 por ciento se enfocan en objetivos especificos y tangibles para  lo que desean en la vida. # 19 por ciento se fijan metas alineadas con su proposito,an organization dedicated to training and publication. It illustrated the infrequency with which individuals develop strategies to achieve their dreams. This is what the study revealed about the people examined: <t> 26 percent focus on specific and tangible goals for what they want in life. # 19 percent set goals aligned with their purpose
1407, mision  y pasion.  J. 15 por ciento escriben todas sus metas con detalles especificos  medibles. 4> 12 por ciento mantienen una meta claramente definida para cada interes principal en su vida y para cada papel que desempeñan. <C 12 por ciento identifican metas diarias,mission and passion. J. 15 percent write down all their goals with specific measurable details. 4> 12 percent maintain a clearly defined goal for each main interest in their life and for each role they play. <C 12 percent identify daily goals
1408, semanales y a largo plazo relacionadas con fechas limite.  <! 7 por ciento toma accion diaria para lograr por lo menos una  meta. 7  Los autores del estudio comentan que los estadounidenses,weekly and long-term related deadlines. <! 7 percent take daily action to achieve at least one goal. 7 The authors of the study comment that Americans
1409, nue- vamente,again
1410," merecen una calificacion de ""reprobado"" en esta area critica de su rendimiento. Dicho sencillamente","they deserve a grade of ""reprobate"" in this critical area of their performance. Simply put"
1411, fracasan en tomar las- acciones necesarias de modo sistematico para trasladar sus sueños y visiones de sus corazones y mentes hacia sus vidas. El resultado final es que la mayoria de las personas fracasan en tomar accion para lograr sus sueños,they fail to take the necessary actions in a systematic way to translate their dreams and visions of their hearts and minds into their lives. The end result is that most people fail to take action to achieve their dreams
1412, y ese fracaso es resultado de la muy poca planifi- cacion estrategica.  COMO HACER QUE TU SUEÑO SEA SEGURO  La novelista inglesa Mary Webb aconseja: Ponle montura a tus  sueños antes de montarlos.  Que significa eso? Significa que hay  que planear para planear. Una estrategia es parte tan importante del  sueño como el sueño mismo. La mayoria de las personas concuerdan  en que la planificacion es importante. No obstante,Traduciendo…
1413, aun asi descuidan  el hacerlo. Olvidan convertirlo en parte del proceso. Se ocupan tanto  en mirar a las estrellas que se olvidan de desarrollar una estrategia.  Mi meta en este capitulo es ayudarte a planear para planear.  Debido a que cada sueño es unico,The process. They are so busy looking at the stars that they forget to develop a strategy. My goal in this chapter is to help you plan for planning. Because each dream is unique
1414, no me es posible darte pautas  especificas. Sin embargo,I can not give you specific guidelines. But nevertheless
1415, puedo darte un enfoque hacia la planifica-  cion para ayudarte. Este es mi enfoque,I can give you a focus on planning to help you. This is my approach
1416, y se basa en la palabra seguro.  Espero que sientas que es util y memorable:  SEÑALA TODAS TUS POSICIONES  El proceso de alcanzar tu sueño es semejante a alcanzar un destino  empleando un aparato de GPS (sistema de posicionamiento global,and it's based on the word safe. I hope you feel it is useful and memorable: POINT OUT ALL YOUR POSITIONS The process of achieving your dream is similar to reaching a destination using a GPS device (global positioning system)
1417,  por sus siglas en ingles). Si sabes donde te encuentras y le indicas  donde quieres ir,for its acronym in English). If you know where you are and you indicate where you want to go
1418, el aparato crea un mapa para ti. La diferencia entre  el GPS y tu es que a ti te toca crear todas tus direcciones,the device creates a map for you. The difference between GPS and you is that it's up to you to create all your addresses
1419, interseccion  por interseccion. El novelista estadounidense MarkTwain insistia en  decir: El secreto de salir adelante es empezar. El secreto de empezar  es desglosar las tareas complejas y abrumadoras en tareas pequeñas y  laciles de manejar,"intersection by intersection. The American novelist MarkTwain insisted on saying: The secret of getting ahead is to start. The secret to start is to break down complex and overwhelming tasks into small, easy-to-manage tasks"
1420, y luego empezar por la primera.  La pregunta del camino:  Tengo una estrategia para alcanzar mi sueño? !-Vive tu sueño!  2. Mi posicion futura. A continuacion,and then start with the first one. The question of the way: I have a strategy to achieve my dream? !-Live your dream! 2. My future position. Then
1421, pongo en palabras donde quiero ir. Esro lo hago preguntandome:  Como se vera mi sueño cuando lo logre? Identificar mi posicion futura me da direccion y motivacion para seguir mi sueño. El industrial millonario Henry J. Kaiser,I put in words where I want to go. I do this by asking myself: How will my dream look when I achieve it? Identifying my future position gives me direction and motivation to follow my dream. Millionaire industrialist Henry J. Kaiser
1422, fundador de Kaiser Aluminum,founder of Kaiser Aluminum
1423, al igual que del sistema de cuidados medicos Kaiser-Permanente,like the Kaiser-Permanente health care system
1424, afirmo: La evidencia esta abrumadoramente a favor de que no es posible empezar a lograr lo mejor a menos que uno se fije cierta meta en la vida.  La evidencia esta abrumadoramente a favor de que no es posible empezar a lograr lo mejor a menos i .. . \' que uno se fije cierta meta en la vida.  1^ - H ENRY ). KA ] S E R  3. Las posiciones intermedias. Luego,I affirm: The evidence is overwhelmingly in favor of not being able to start achieving the best unless one sets a certain goal in life. The evidence is overwhelmingly in favor of not being able to start achieving the best unless i ... \ 'that one set a certain goal in life. 1 ^ - H ENRY). KA] S E R 3. The intermediate positions. Then
1425, intento descubrir el camino que esta entre aquellos dos puntos haciendome la pregunta:  Cuales son los pasos que necesito tomar de mi posicion presente a la futura? Es necesario que te fijes una serie de metas pequeñas para llegar donde quieres ir. Como lo señala el autor y amigo Dick Biggs: Tu sueño es una vista general e idealista de donde quietes ir; tus metas son declaraciones especificas y realistas de como vas a llegar alla. Cuando empiezas a escribir los pasos que esperas tomar para alcanzar tu sueño,I try to discover the path that is between those two points asking me the question: What are the steps I need to take from my present position to the future? It is necessary that you set a series of small goals to get where you want to go. As the author and friend Dick Biggs points out: Your dream is a general and idealistic view of where you want to go; your goals are specific and realistic statements of how you are going to get there. When you start to write the steps you hope to take to achieve your dream
1426, no esperes poder seguirlos de modo rapido ni facil. Los planes son claros y sencillos. La vida y la busqueda de sueños son cosas engorrosas. Crear el proceso es el punto de partida y te pone en marcha,Do not expect to follow them quickly or easily. The plans are clear and simple. Life and the search for dreams are cumbersome things. Creating the process is the starting point and puts you in motion
1427, pero esto dista mucho de ser una ciencia exacta. El cineasta George Lucas comento: Fijarse metas realistas es una de las cosas mas dificiles de hacer porque uno no siempre sabe  110 109  > V El secreto de salir adelante es empezar. El secreto de empezar i es desglosar las tareas complejas y abrumadoras en tareas pequeñas y faciles de manejar,"but this is far from being an exact science. Filmmaker George Lucas commented: Setting yourself realistic goals is one of the hardest things to do because you do not always know 110 109> V The secret to getting ahead is to start. The secret to starting i is to break down complex and overwhelming tasks into small, easy-to-manage tasks"
1428, y luego empezar por la primera.  -MARK TWAIN I  Cuando quiero crear un plan para lograr un sueño,and then start with the first one. -MARK TWAIN I When I want to create a plan to achieve a dream
1429, empiezo señalando mis posiciones en el proceso...  1. Mi posicion presente. En primer lugar,I begin by pointing out my positions in the process ... 1. My present position. First
1430, me pregunto:  Donde estoy ahora?Tengo que ser honesto en cuanto a mi posicion presente. Es imposible ignorar la realidad de mi posicion presente y lograr el exito. Si no tengo certeza en cuanto a mi posicion actual en relacion con mi sueño,I wonder: Where am I now? I have to be honest about my present position. It is impossible to ignore the reality of my present position and achieve success. If I am uncertain about my current position regarding my dream
1431, entonces pedire a otros que me ayuden a determinarla. El antiguo presidente de la junta ejecutiva de Genetal Electric,Then I will ask others to help me determine it. The former president of the executive board of Genetal Electric
1432, Jack Welch,Jack Welch
1433, observo: La estrategia consiste en primero tratar de comprender donde estas en el mundo actual,I observe: The strategy consists of first trying to understand where you are in the current world
1434, no donde quisieras estar,not where you would like to be
1435, ni donde esperabas estar,or where you expected to be
1436, sino donde estas. Luego consiste en tratar de comprender donde quisieras estar en cinco años. Final- mente,but where are you Then it's about trying to understand where you would like to be in five years. Finally
1437, consiste en evaluar las probabilidades realistas de llegar desde aqui hasta alla. Si eres como la mayoria de las personas,it consists in evaluating the realistic probabilities of arriving from here to there. If you are like most people
1438, tal vez no estes muy contento con tu punto de partida. Peto cuando consideres tu posicion presente,maybe you are not very happy with your starting point. When you consider your present position
1439, toma aliento de las palabras de Richard Evans,Take a breath from the words of Richard Evans
1440, quien escribio El regalo de Navidad. El dijo: Todos los que llegaron donde estan tuvieron que empezar donde estaban.  La pregunta del camino:  Tengo una estrategia para alcanzar mi sueño?  ni  !-Vive tu sueño!  La verdadera diferencia entre buscar un sueño y hacerse una ilusion es lo que haces dia a dia.  Al principio,who wrote The Christmas present He said: Everyone who arrived where they were had to start where they were. The question of the way: I have a strategy to achieve my dream? ni! -Live your dream! The real difference between finding a dream and becoming an illusion is what you do day by day. At first
1441, basta con que empieces a moverte. Intenta cosas diferentes. Es mucho mas facil empezar a hacer algo bien si ya empe- zaste a hacer algo. Dennis Bakke,to do something right if you've already started doing something. Dennis Bakke
1442, cofundador y antiguo presidente de la junta ejecutiva de la firma de distribucion de energia electrica estadounidense AES,cofounder and former president of the executive board of the American power distribution firm AES
1443, una vez dijo: Intentamos un monton de cosas,He once said: We try a lot of things
1444, vemos que es lo que funciona,we see what works
1445, y luego llamamos a eso nuestra estrategia. En otras palabras,and then we call that our strategy. In other words
1446, si no sabes exactamente que hacer,If you do not know exactly what to do
1447, no permitas que eso te impida hacer algo.  2. Haz algo hoy que este relacionado con tu sueño. El corredor,do not let that stop you from doing something. 2. Do something today that is related to your dream. The corridor
1448, autor y cardiologo George Sheehan observo: Hay aquellos que siempre estan a punto de empezat a vivir. Esperan a que las cosas cambien,author and cardiologist George Sheehan observed: There are those who are always about to start living. They wait for things to change
1449, hasta que haya mas tiempo,until there is more time
1450, hasta que esten menos cansados,until they are less tired
1451, hasta recibir un ascenso,until receiving a promotion
1452, hasta establecerse: hasta,until established: until
1453, hasta,until
1454, hasta. Siempre parece haber un evento principal que debe suceder primero en sus vidas antes de que empiecen a vivirlas. Si quieres lograr tus sueños,until. There always seems to be a main event that must happen first in their lives before they begin to live them. If you want to achieve your dreams
1455, !-no puedes permitirte ser una de esas personas!  Como puedes evitarlo? Haciendo algo que te avance hacia tu sueño hoy. Chris Matthews,! -You can not afford to be one of those people! How can you avoid it? Doing something that will move you towards your dream today. Chris Matthews
1456, periodista de TV y anfitrion del programa Hardball,TV journalist and host of the Hardball program
1457, aconseja: Sean cuales sean tus ambiciones,Advise: Whatever your ambitions
1458, sea cual sea el campo en el cual deseas entrar,whatever field you wish to enter
1459, si quieres jugar el partido,if you want to play the game
1460, tienes que ir donde se juega. Si quieres ser abogado,You have to go where you play. If you want to be a lawyer
1461, matriculate a estudiar Derecho. Si no puedes entiar a la mejor escuela de derecho,enroll to study law. If you can not understand the best law school
1462, entra a la mejor escuela que puedas. Igual con la escuela de medicina o de  112  exactamente hacia donde va,enter the best school you can. Same with medical school or 112 exactly where it's going
1463, ni tampoco debiera saberlo. Para mi,nor should I know. For me
1464, fijarme solo las metas de sacar calificaciones aceptables en la escuela y tomar materias en las cuales me sentia algo interesado fue una meta grande,setting myself only the goals of getting acceptable grades in school and taking subjects in which I felt somewhat interested was a big goal
1465, y en eso me enfoque.  Muchas personas erroneamente creen que han terminado con la pregunta del camino tan pronto saben donde estan,and in that I focus. Many people mistakenly believe that they have finished with the road question as soon as they know where they are
1466, saben donde quieren ir y han identificado los pasos que pueden llevarlos de un punto al otro. Si eso fuera cierto,they know where they want to go and have identified the steps that can take them from one point to the other. If that were true
1467, habria mas gente alcanzando sus sueños. La estrategia consta de mas que solo pasos. Eso nos lleva a la siguiente cosa que es necesario hacer como parte del proceso,There would be more people reaching their dreams. The strategy consists of more than just steps. That brings us to the next thing that needs to be done as part of the process
1468, despues de que hayas señalado tus posiciones.  EXAMINA TODAS TUS ACCIONES  La verdadera diferencia entre buscar un sueño y hacerse una ilusion es lo que haces dia a dia. John Ruskin,after you have indicated your positions. EXAMINE ALL YOUR ACTIONS The real difference between seeking a dream and becoming an illusion is what you do every day. John Ruskin
1469, autor britanico,British author
1470, critico de las artes y comentarista social,critic of the arts and social commentator
1471, dijo: Lo que pensamos,He said: What we think
1472, o lo que sabemos,or what we know
1473, o lo que creemos,or what we believe
1474, a fin de cuentas,after all
1475, es de poca consecuencia. Lo unico realmente trascendente es lo que hacemos. Para alcanzar tu sueño,It is of little consequence. The only truly transcendent is what we do. To achieve your dream
1476, debes:  /. Hacer algo. El proceso se inicia haciendo algo,you must:  /. Do something. The process starts doing something
1477, haciendo lo que sea,doing whatever
1478, si eres una persona sedentaria por naturaleza o estas desalentado. John Hancock,If you are a sedentary person by nature or you are discouraged. John Hancock
1479, uno de los que firmo la Declaracion de la Indepen- dencia de Estados Unidos,one of those who signed the Declaration of Independence of the United States
1480, afirmo: Todas las personas valiosas tienen buenos pensamientos,I affirm: All the valuable people have good thoughts
1481, buenas ideas y buenas intenciones,good ideas and good intentions
1482, pero muy pocas de ellas las convierten en accion.  La pregunta del camino:  Tengo una estrategia para alcanzar mi sueño?  113  !-Vive tu sueño!  GANA AL CONSIDERAR TODAS TUS OPCIONES  George S. Patton,but very few of them turn them into action. The question of the way: I have a strategy to achieve my dream? 113! -Live your dream! WIN BY CONSIDERING ALL YOUR OPTIONS George S. Patton
1483, Jr.,Jr.
1484, general durante la Segunda Guerra Mundial,General during World War II
1485, declaro: Los generales de exito hacen planes que encajan todas sus circunstancias,I declare: Successful generals make plans that fit all their circumstances
1486, pero no tratan de crear circunstancias que se ajusten a sus planes. Una vez que hayas elaborado un plan para alcanzar tu sueño,but do not try to create circumstances that fit your plans. Once you have drawn up a plan to achieve your dream
1487, es decir,that is to say
1488, los pasos intermedios que piensas que te condu- ciran a tu destino,the intermediate steps that you think will lead you to your destination
1489, existe el peligro de que te tornes inflexible y que busques mantener tu plan a toda costa. Algunas veces resulta sabio evaluar otras alternativas. Cuando tienes dificultades para avanzar,there is a danger that you become inflexible and that you seek to maintain your plan at all costs. Sometimes it is wise to evaluate other alternatives. When you have difficulties to advance
1490, no seas pronto para modificar tu sueño. En lugar de ello,Do not be quick to modify your dream. In stead of
1491, modifica tu plan.  |f Los generales de exito hacen planes que encajan todas |j| sus circunstancias,modify your plan | f Successful generals make plans that fit all | j | your circumstances
1492, pero no tratan de crear ji circunstancias que se ajusten a sus planes.  GEORGE S. PATTON JR.  Peter Drucker,but they do not try to create circumstances that fit their plans. GEORGE S. PATTON JR. Peter Drucker
1493, frecuentemente denominado el padre de la admi- nistracion moderna,frequently called the father of modern administration
1494, comprendia la incertidumbre que acompaña a la planificacion estrategica. No es una ciencia exacta,he understood the uncertainty that accompanies strategic planning. It is not an exact science
