,español,ingles
688, escritor y editor Ed Rowell dice: Un sueño es un mejor futuro en busca de un arquitecto que muestre a otros como convertirlo en realidad. Si eres un lider,Writer and editor Ed Rowell says: A dream is a better future in search of an architect that shows others how to turn it into reality. If you are a leader
689, es necesario que seas ese arquitecto. Es necesario que identifiques el sueño y que seas capaz de dibujarlo,It is necessary that you be that architect. It is necessary that you identify the dream and that you are able to draw it
690, no solo por tu beneficio,not only for your benefit
691, sino por el de los demas. Una noche en Dallas cene con un arquitecto cuyo nombre es John Fleming. Me dijo: Si eres un arquitecto,but for that of others. One night in Dallas dine with an architect whose name is John Fleming. He told me: If you are an architect
692, no puedes empezar un proyecto de construccion hasta haberlo terminado. Con eso,You can not start a construction project until you have finished it. With that
693, quiso decir que si eres el visionario,He wanted to say that if you are the visionary
694, el lider,leader
695, tienes que saber el final antes de empezar. Tienes que poder verlo. Si no,You have to know the ending before you start. You have to be able to see it. If not
696, tu equipo nunca podra cumplir tu vision. Como lider y mentor de lideres,Your team will never be able to fulfill your vision. As leader and mentor of leaders
697, pienso continuamente sobre como comunicar una vision a otros. Si los lideres crean un cuadro borroso,I continually think about how to communicate a vision to others. If the leaders create a blurry picture
698, entonces los demas los seguiran de manera igualmente borrosa. La falta de claridad obstaculiza la iniciativa,then the others will follow them in an equally blurry way. The lack of clarity hinders the initiative
699, inhibe la persis- tencia y socava el seguimiento. Los seguidores no entregan lo mejor de si a algo que no comprenden. Las personas no perseveran en el rumbo por algo que no pueden ver. Nadie se siente motivado por algo en lo que mas o menos,inhibits persistence and undermines follow-up. Followers do not give the best of themselves to something they do not understand. People do not persevere on the path for something they can not see. Nobody feels motivated by something in what more or less
700, quizas cree.  Los seguidores no entregan lo mejor de si a algo que no comprenden. Las personas no perseveran en el rumbo por algo que no pueden ver. Nadie se siente motivado por algo en lo que mas o menos,Maybe you believe. Followers do not give the best of themselves to something they do not understand. People do not persevere on the path for something they can not see. Nobody feels motivated by something in what more or less
701, quizas cree.  La pregunta de la claridad: i Puedo ver mi sueño claramente ?  SI PUEDES VERLO. PUEDES APROVECHARLO  La mayoria de las personas vagan por la vida. Carecen de un sueño claro,Maybe you believe. The question of clarity: Can I see my dream clearly? IF YOU CAN SEE IT. YOU CAN TAKE ADVANTAGE Most people wander through life. They lack a clear dream
702, de un cuadro claro del destino que desean,of a clear picture of the destination they want
703, y aun cuando se les presenta una oportunidad magnifica,and even when you have a great opportunity
704, no tienen la capacidad de verla y de edificar un sueño sobre ella. En 1866 un aficionado a la geologia observo a unos niños suda- fricanos que jugaban con una piedra brillante. Intrigado,they do not have the capacity to see it and to build a dream about it. In 1866 an amateur geologist observed some South African children playing with a shiny stone. Intrigued
705, le pidio a la madre de los niños si podia comprarla. Ella le dijo que no tenia valor alguno y sencillamente se la entrego. Posteriormente,He asked the mother of the children if he could buy it. She told him that it had no value and simply handed it to her. Later
706, al examinarlo de cerca,when examining it closely
707, se confirmo su corazonada: era un diamante. El calculo su peso en veintiun quilates. 1 Cuando otros se enteraron de este y de otros descubrimientos,his hunch was confirmed: it was a diamond. He calculated his weight in twenty-one carats. 1 When others learned about this and other discoveries
708, un minerologo escoces llamado James Gregory fue enviado a investigar. El informo que Sudafrica no era un lugar adecuado para la formacion de diamantes. Especulo que los descubrimientos previos habian sido el resultado de avestruces,A Scottish minerologist named James Gregory was sent to investigate. He informed that South Africa was not a suitable place for diamond formation. I speculate that the previous discoveries had been the result of ostriches
709, quien lo iba a decir,Who was going to say it
710, que habian ingerido las gemas en alguna tierra distante y las habian depositado en Suda- frica con su estiercol. Pocos dias despues de lanzado el informe de Gregory al publico,that they had ingested the gems in some distant land and deposited them in South Africa with their manure. A few days after the release of Gregory's report to the public
711, se hallo un diamante de ochenta y tres quilates en la zona que el habia examinado. Hoy se le conoce como la Estrella de Sudafrica,He found a diamond of eighty-three carats in the area he had examined. Today it is known as the Star of South Africa
712, y lanzo la primera operacion minera de la region que en la actua- lidad es la productora mas grande de diamantes del mundo.  Que sucedio con Gregory? Su nombre perdura,and launched the first mining operation in the region that is currently the largest producer of diamonds in the world. What happened to Gregory? His name endures
713, pero no como el lo habria querido. En la industria de los diamantes,but not as he would have liked it. In the diamond industry
714, cuando alguno exhibe un criterio malo,when someone exhibits a bad criterion
715, se conoce como hacer un Gregory. 2  45  i Vive tu sueño!  Entre las personas que acudieron en masa a Sudafrica durante la fiebre de los diamantes se hallaba Cecil Rhodes,It is known as making a Gregory. 2 45 i Live your dream! Among the people who flocked to South Africa during the diamond rush was Cecil Rhodes
716, un joven brita- nico que soñaba con el exito. El y su hermano vieron el potencial de la mineria de diamantes en la zona y compraron tantos terrenos como pudieron. Tambien compraron una maquina de hacer hielo en Inglaterra,a young Briton who dreamed of success. He and his brother saw the potential of diamond mining in the area and bought as much land as they could. They also bought an ice machine in England
717, la cual trajeron a Africa para poder venderles hielo a los mineros que luchaban con el calor. Utilizaron sus ganancias para comprar mas terrenos con posibilidades mineras. En la decada de 1880,which they brought to Africa to be able to sell ice to the miners who were struggling with the heat. They used their profits to buy more land with mining possibilities. In the 1880s
718, Rhodes fundo la empresa De Beers,Rhodes founded the company De Beers
719, la productora de diaman- tes mas grande del mundo. 3   Como describirias tu vision cuando se trata de tu sueño?  Aceptas ciegamente el estado actual de las cosas?  O miras las cosas con los ojos bien abiertos,the largest diamond producer in the world. 3 How would you describe your vision when it comes to your dream? Do you blindly accept the current state of affairs? Or you look at things with wide eyes
720, buscando posibilidades mayores? Y cuando ves estas cosas,looking for bigger possibilities? And when you see these things
721,  tienes un deseo suficientemente serio de convertir un sueño en realidad como para ponerlo a prueba por medio de defi- nirlo con claridad?  Estas dispuesto a describirlo en detalles,Do you have a serious enough desire to make a dream come true to test it by clearly defining it? You are willing to describe it in detail
722, ponerlo por escrito y contarselo a otros?  Solo aquellos que ven su sueño son capaces de aprovecharlo.  Si no lo estas,put it in writing and tell others? Only those who see their dream are able to take advantage of it. If you are not
723, entonces te has colocado en desventaja. Solo aquellos que ven su sueño son capaces de aprovecharlo. Si puedes responder a la pregunta de la claridad con un si porque ves tu sueño con claridad,then you have placed yourself at a disadvantage. Only those who see their dream are able to take advantage of it. If you can answer the question of clarity with a yes because you see your dream clearly
724, entonces habras aumentado significativamente las pro- babilidades de que un dia llegues a hacer mas que solo ver tu sueño,then you will have significantly increased the probabilities that one day you will do more than just see your dream
725, ;lo viviras!  46   PUEDES RESPONDER AFIRMATIVAMEN- TE A LA PREGUNTA DE LA CLARIDAD:  PUEDO VER MI SUEÑO CLARAMENTE?  Es hora de darle claridad a tu sueño,you will live it! 46 CAN YOU ANSWER AFFIRMATIVELY TO THE QUESTION OF CLARITY: CAN I SEE MY DREAM CLEARLY? It's time to clarify your dream
726, de darle detalle. Si tienes una idea genetal de tu sueño,to give details. If you have a genetic idea of your dream
727, podrias sentirte tentado a empezar a crear tu estrategia. No lo hagas aun. Como lo afirmo Mike Hyatt,You might be tempted to start creating your strategy. Do not do it yet. As stated by Mike Hyatt
728, es nece- sario tener una vision primero. Empieza por escribir una descripcion detallada de tu sueño. Dale rienda suelta a tu imaginacion. Escribe tantos elementos o partes de ella como puedas. No te detengas hasta que tengas mas de lo eme creas que necesitas. Ahora cuantifica todo lo que puedas. Conviertelo en algo que puedas evaluar. No te preocupes de como llegaras alla. Se osado,It is necessary to have a vision first. Start by writing a detailed description of your dream. Give your imagination a free rein. Write as many elements or parts of it as you can. Do not stop until you have more of what you think you need. Now quantify everything you can. Turn it into something you can evaluate. Do not worry about how you will get there. He dared
729, se audaz,be bold
730, !-sueña en grande! El siguiente paso consiste en declarar tu sueño de modo conciso por esetito. Mike desgloso su sueño en diez elementos claros y capaces de ser evaluados. Haz algo similar con tu sueño. El numero de elementos no importa,!-dream big! The next step is to declare your dream in a concise way by little. Mike broke his dream into ten clear elements capable of being evaluated. Do something similar with your dream. The number of elements does not matter
731, pues sencillamente debe corresponder con el sueño,because it simply must correspond with the dream
732, pero trata de mantenerlo reducido. No esperes ser capaz de terminar todo el proceso en una sola sesion. Para la mayoria de las personas,but try to keep it reduced. Do not expect to be able to finish the whole process in one session. For most people
733, eso no es posible. En lugar de ello,that is not possible. In stead of
734, dale tiempo. Tal vez quieras apartarte en un retiro para iniciar el proceso. Si puedes separarte de tu entorno habitual o de tu rutina por un par de dias,give it time. Maybe you want to get away in a retreat to start the process. If you can separate yourself from your usual environment or your routine for a couple of days
735, podrias lograr la mayor parte de la tarea. De lo contrario,You could achieve most of the task. On the contrary
736, saca un dia para soñar y luego retorna al proceso unas cuantas horas por vez en las semanas subsiguientes. No olvides tu meta de expresar tu sueño de la forma mas clara y especifica posible. Mantenlo delante de ti para que puedas verlo todos los dias.  47  CAPITULO 3  La pregunta de la realidad:  Estoy dependiendo de factores bajo mi control para lograr mi sueño?  La nulidad... es enemiga de las fantasias pero no de los sueños.  RUDY RUKTTICER  Los sueños,Take a day to dream and then return to the process a few hours at a time in the following weeks. Do not forget your goal to express your dream in the clearest and most specific way possible. Keep it in front of you so you can see it every day. 47 CHAPTER 3 The reality question: Am I depending on factors under my control to achieve my dream? The nullity ... is the enemy of fantasies but not of dreams. RUDY RUKTTICER Dreams
737, por definicion,by definition
738, no estan supuestos a empezar con la realidad. Se supone que sean fantasticos,they are not supposed to start with reality. They are supposed to be fantastic
739, increibles,incredible
740, fuera de serie. Despues de todo,out of series. After all
741, nacen de esperanzas,They are born of hope
742, deseos y posibilidades. Son producto de la imaginacion y creatividad. No obstante,wishes and possibilities. They are products of imagination and creativity. However
743, eso tambien presenta un problema.  Acaso vale la pena seguir un sueño si no tiene posibilidades de convertirse en realidad? Creo que no. Muchos han sido engañados cuando se trata de los sueños. Han escuchado a padres,that also presents a problem. Is it worthwhile to follow a dream if it has no chance of becoming a reality? I think not. Many have been deceived when it comes to dreams. They have listened to parents
744, educadores y oradores decir cosas tales como: Puedes ir tan lejos como te lleven tus sueños,Educators and speakers say things such as: You can go as far as your dreams take you
745, o Si lo crees,o If you think so
746, puedes lograrlo. Han leido las palabras de Edmund O\'Neil,you can achieve it. They have read the words of Edmund O \ 'Neil
747, quien afirmo acerca de los soñadores: Tienes la capacidad de lograr lo que buscas,who affirmed about the dreamers: You have the ability to achieve what you are looking for
748," dentro de ti esta todo el potencial que puedas imaginar. Siempre  48  IJ"" Mi l ICIIIMO I J l.| 1.1 lOgl.ll lili Slll\'f t  apunta mas alto de lo que creas que puedes lograr. Con frecuencia descubriras que puedes lograr cualquier meta. !-Que patraña! No creo que eso sea cierto acerca de tus sueños","Within you is all the potential you can imagine. Always 48 IJ ""My First I llllllllllllllllllllllllllllllllllllllllllllllllllllllllllllllllllllllllllllllllllllllllllllllllllllllllllllllllllllllllllllllllllllllllllllllllllllllllllllllllllllllllllllllllllllllllllllllllllllllllllllllllllllllllllllllllllllllllllllllllllllllllllllllllllllllllllllllllllllllllllllllllllllllllllllllllllllllllllllllllllllllllllllllllllllllllllllllllllllllllllllllllllllllllllllllllllllllllllllllllllllllllllllllllllllllllllllllllllllllllllllllllllllll true about your dreams"
749, ni tampoco de los mios. Si,nor of mine. Yes
750, hay que apuntar alto. Sin embatgo,you have to aim high. Without interruption
751, no tenemos la capacidad de logtar cualquier cosa que busquemos. No poseo la capacidad de lograr todo el potencial que me imagine. No creo que pueda lograr cualquier meta. Eso no es realidad. El escritot Richard Badb afirma algo similar: Nunca se te da un deseo sin que tambien se te conceda la facultad de convertirlo en realidad. Si piensas en eso aunque sea por un instante de modo racional,we do not have the capacity to accomplish anything we seek. I do not have the capacity to achieve all the potential that I imagine. I do not think I can achieve any goal. That is not reality. The writing Richard Badb says something similar: You never give a wish without also being granted the ability to make it a reality. If you think about it even for a moment rationally
752, te das cuenta que no es cierto. En algun momento,you realize that it is not true. Sometime
753, casi todo niño sueña con ser capaz de volar como un ave.  No seria fan- tastico lograrlo? Pues eso no sucedera,almost every child dreams of being able to fly like a bird. Would not it be fantastical to achieve it? Well that will not happen
754, no importa cuan claramente me lo imagine.  MENTALIDAD INCORRECTA EN CUANTO AL EXITO  Si dudas del hecho que la gente se ttaga estas promesas falsas,it does not matter how clearly I imagine it. INCORRECT MENTALITY REGARDING SUCCESS If you doubt the fact that people will follow these false promises
755, todo lo que tienes que hacer es ver el programa de television American Idol. Si lo has visto,All you have to do is watch the American Idol television show. If you have seen it
756, sabes a que me refiero. Decenas de miles de personas se inscriben para las eliminatorias de American Idol,you know what I mean. Tens of thousands of people sign up for the American Idol playoffs
757, pero usualmente solo los mejores,but usually only the best
758, y los peores,and the worst
759, reciben la oportunidad de presentarse delante de los jueces,they receive the opportunity to appear before the judges
760, quienes escogen a concursantes para ganarse un contrato de grabacion.  Algunos de los concursantes no tienen ni la mas minima idea en cuanto a si mismos y sus habilidades. Desentonan,who choose contestants to win a recording contract. Some of the contestants do not have the slightest idea about themselves and their abilities. Decoup
761, chillan,shriek
762, braman y aullan. Entonces les dicen a todos lo orgullosos y ferozmente  49  !-Vive tu sueño!  5\xb0  I onliados que se sienten de su talento,bray and howl. Then they tell everyone proudly and fiercely 49! -Live your dream! 5 \ xb0 Ilians who feel of their talent
763, aun los que nunca han cantado <ii publico en su vida. Y cuando los jueces  un musico y productor profesional,even those who have never sung <ii publish in his life. And when the judges a professional musician and producer
764, una artista con seis discos que llegaron al primer lugar y un ejecutivo de un sello disquero (con un total combinado de sesenta años de experiencia)  les dicen que no tienen suficiente para avanzar,an artist with six records that came in first place and an executive of a record label (with a combined total of sixty years of experience) tell them they do not have enough to advance
765, estos soñadores echan rabietas,these dreamers throw temper tantrums
766, escupen insultos y pro- nuncian: !-Pues esas son sus opiniones! !-Soy excelente! Tengo que admitir que algunas de las eliminatorias me resultan entretenidas,"They spit insults and proclaim: ""Well, those are your opinions! !-I am excellent! I have to admit that some of the heats are fun for me"
767, pero no puedo evitar preguntarme donde se encuen- tran los amigos y familiares de los que hacen la audicion.  No hay nadie que les haya dicho la verdad acerca de si mismos?  Nadie les ha dado un toque de realidad? !-Todos salvo los concursantes saben que carecen totalmente de los calificativos necesarios para alcanzar su sueño! Creer en un sueño no basta. Quererlo con desesperacion no basta.  Acaso no sienten pasion estos concursantes por su sueño? Si.  Estan comprometidos con su sueño? Si,but I can not help but wonder where the friends and family of those who audition are. Is there no one who has told you the truth about themselves? Has anyone given you a touch of reality? ! - All except the contestants know that they totally lack the necessary qualifications to achieve their dream! Believing in a dream is not enough. Wanting it with despair is not enough. Do not these contestants feel passion for their dream? Yes. Are you committed to your dream? Yes
768, por lo menos en ese momento.  Lograran su sueño de ser el ganador de American Idol?. !-No!  Por que? Porque su sueño nunca ha tenido un encuentro con la realidad.  TALENTO,at least at that time. They will achieve their dream of being the winner of American Idol ?. !-Do not! Why? Because his dream has never had an encounter with reality. TALENT
769, TRABAJO DURO Y UN SUEÑO  Contraste eso con la historia de Andy Hull,HARD WORK AND A DREAM Contrast that with the story of Andy Hull
770, hijo de John Hull,son of John Hull
771, presidenre y director ejecutivo de EQUIP y de Injoy Stewardship Services. A Andy siempre le ha encantado la musica. Su madre,president and executive director of EQUIP and Injoy Stewardship Services. Andy has always loved music. His mother
772, Sitaron,Sitaron
773, dice que Andy aprendio a cantar antes de aprender a hablar. Y mienttas que los padres de familia usualmente tienen que hacer  La pregunta de la realidad:  Estoy dependiendo de factores bajo mi control para lograr mi sueño?  5 1  !-Vive tu sueño!  y forjo un plan para avanzar. La mayoria de los musicos jovenes se entusiasman tanto con firmar con un sello disquero que ceden todos su derechos y asi pierden el control de su musica para poder ganar una buena cantidad de dinero de partida. El sello disquero les da un adelanto y luego se espera que la banda trabaje duro para recuperar ese dinero. Si la banda no percibe las ganancias que el sello deseaba,He says that Andy learned to sing before he learned to speak. And what parents usually have to ask The reality question: Am I depending on factors under my control to achieve my dream? 5 1! -Live your dream! and I forge a plan to move forward. Most young musicians are so enthusiastic about signing with a record label that they give up all their rights and lose control of their music to win a good amount of money. The record label gives them an advance and then the band is expected to work hard to recover that money. If the band does not perceive the profits that the label wanted
774, el sello deja ir a la banda,the seal lets the band go
775, y usualmente no se vuelve a escuchar de ella nunca mas. Andy tenia una idea diferente. No queria firmar un contrato grande y caer en esa trampa. En lugar de ello,and usually it is never heard from again. Andy had a different idea. I did not want to sign a big contract and fall into that trap. In stead of
776, queria lanzar su musica en linea y edificar la aficion por su banda por medio de giras. Tambien queria crear y promover su propio sello disquero. Lo bautizo con el nombre Favorite Gentlemen,I wanted to launch their music online and build the hobby for their band through tours. He also wanted to create and promote his own record label. I baptize him with the name Favorite Gentlemen
777, nombre inspirado por sus jugadores favoritos de los Bravos de Atlanta,name inspired by his favorite Atlanta Braves players
778, el equipo de beisbol. (Andy es muy aficionado a los deporres y seguia a los Bravos luego de haberse trasladado a Atlanta en la decada de 1990.) Rechazo varias ofertas de sellos disqueros hasta que hallo una que le parecio un buen trato: una asociacion con uno que no solo firmaria un contrato con la banda,the baseball team. (Andy is very fond of sports and followed the Braves after moving to Atlanta in the 1990s.) I reject several offers of record labels until I find one that seemed like a good deal: an association with one that not only I would sign a contract with the band
779, sino tambien con el sello Favorite Gentlemen. Andy finalmente hallo ese socio en Sony. Como parte del trato,but also with the stamp Favorite Gentlemen. Andy finally found that partner in Sony. As part of the deal
780, recibio mucho menos dinero como avance pero retuvo mucho mas control de su musica,he received much less money as an advance but retained much more control of his music
781, y recibio algo de dinero de Sony que pudo utilizar para contratar a otras bandas en su sello. La vision de Andy era crear una comunidad de artistas. Un ejecutivo le dijo a Andy que tenia el mejor plan comercial que jamas habia visto en un chico de apenas diecinueve años. Ahora que escribo estas palabras,and he received some money from Sony that he could use to hire other bands on his label. Andy's vision was to create a community of artists. An executive told Andy that he had the best business plan he had ever seen in a boy of just nineteen. Now that I write these words
782, Andy tiene veintiun años,Andy is twenty-one years old
783, es presidente de su sello disquero y ha contratado a diez bandas,he is president of his record label and has hired ten bands
784, las  52  que sus hijos practiquen la musica,the 52 that your children practice music
785, Sharon tenia que hacer que el se detuviera. Andy obtuvo su primera guitarra cuando tenia ocho años y natu- ralmente le puso dedicacion,Sharon had to make him stop. Andy got his first guitar when he was eight years old and naturally put his dedication
786, aprendiendo por si solo a tocar los acordes. Tambien tomo otros instrumentos y aprendio a tocarlos,learning by itself to play the chords. He also took other instruments and learned to touch them
787, tales como la trompeta y el piano,such as the trumpet and the piano
788, pero Sharon dice que parece tener una afinidad especial por los instrumentos de cuerda. No fue sorpresa alguna cuando formo su primera banda en el sexro grado. El y sus amigos acostumbraban tocar en un deposito con paredes de hormigon que quedaba cerca de su casa en Toronto. Para los trece años de edad,but Sharon says he seems to have a special affinity for string instruments. It was no surprise when he formed his first band in the sixth grade. He and his friends used to play in a warehouse with concrete walls that was close to his house in Toronto. For thirteen years of age
789, el y un amigo componian regularmente canciones por telefono,he and a friend regularly composed songs by phone
790, usando una grabadora para captar sus creaciones. Cuando Andy llego al bachillerato,using a recorder to capture his creations. When Andy arrived at the baccalaureate
