,español,ingles
2208, la cual utilizo en ultima instancia para cambiar su vida.  SUEÑOS DE LIBERTAD  Kecldy se crio en una zona rural. Sin embargo,which I ultimately use to change your life. DREAMS OF FREEDOM Kecldy grew up in a rural area. But nevertheless
2209, cuando la familia que ella servia se traslado al pueblo de Petersburgo,when the family she served moved to the town of Petersburg
2210, Virginia,Virginia
2211, sucedio algo importante. Kecldy,Something important happened. Kecldy
2212, que tenia veintitantos años de edad,that he was in his twenties
2213, vio el potencial de tornarse en empresaria. Aproximadamente la mitad de la poblacion de Petersburgo era de raza negra,He saw the potential to become a businesswoman. Approximately half of the population of Petersburg was black
2214, y mas o menos la tercera parte de esos individuos eran libres. 2 Mientras viajaba por  U.S  !-Vive tvi sueño!  la ciudad,and about a third of those individuals were free. 2 While traveling by U.S! -Vive tvi dream! the city
2215, descubrio que muchas de las personas negras libres eran mujeres solteras que tenian propiedades y manejaban un negocio propio. Kecldy vio posibilidades para si misma porque para ese entonces se habia desarrollado como modista de alta costura. Un sueño empezo a sembrarse en ella. Siendo una eterna pragma- tista,he discovered that many of the free black people were single women who owned property and ran a business of their own. Kecldy saw possibilities for herself because by then she had developed as a haute couture fashionista. A dream began to be sown in her. Being an eternal pragmatist
2216, hasta ese entonces siempre habia logrado aprovechar lo mejor posible su vida como esclava,"Until then, she had always managed to make the most of her life as a slave."
2217, vencer el abuso,beat the abuse
2218, trabajar duro y vivir con integridad. Ahora,Work hard and live with integrity. Now
2219, por primera vez,for the first time
2220, consideraba la posibilidad de algun dia obtener su libertad y rrabajar para si misma. La profe- sora de Harvard,I considered the possibility of someday obtaining their freedom and working for themselves. The Harvard teacher
2221, Jennifer Fleischner,Jennifer Fleischner
2222, observa: En aquellas mujeres negras,notes: In those black women
2223, trabajadoras y de clase media,workers and middle class
2224, Lizzy pudo ver posibilidades mas alla de la esclavitud para alguien como ella. Con un nuevo sabor de autonomia en la boca,Lizzy could see possibilities beyond slavery for someone like her. With a new taste of autonomy in the mouth
2225, pues nunca habia tenido tanta libertad de movimiento ni de pensamiento como aqui en Petersburgo,for I had never had as much freedom of movement or thought as here in Petersburg
2226, empezo a querer mas. 3 Otro traslado,I started to want more. 3 Other transfer
2227, esta vez a San Luis,this time to San Luis
2228, Missouri,Missouri
2229, cuando tenia vein- tinueve años de edad,when I was twenty-nine years old
2230, hizo que el sueño que albetgaba Kecldy en su interior se hiciera mas fuerte. La familia a la cual servia estaba experimentando epocas dificiles,He made Kecldy's dream inside him grow stronger. The family I served was experiencing difficult times
2231, asi que ella empezo a confeccionar vestidos no solo para las mujeres de aquella familia,So she started to make dresses not only for the women of that family
2232, sino tambien para otras damas prominentes de la sociedad del pueblo,but also for other prominent ladies of the people's society
2233, para ganar dinero.  Con mi aguja  recuerda Kecldy ,to earn money. With my needle remember Kecldy
2234, mantuve pan en las bocas de diecisiete personas por dos años y cinco meses . 4 Cada vez mas,I kept bread in the mouths of seventeen people for two years and five months. 4 More and more
2235, la independencia,the independence
2236, tanto legal como economica,both legal and economic
2237, cursaba por su mente. Cuando abordo el tema de comprar su libertad con su amo,It was going through his mind. When I approach the subject of buying your freedom with your master
2238, el se nego a discutirlo y le ordeno que nunca mas tocara el tema. Pero para  176  La pregunta de la tenacidad:  Me estoy acetcando a mi sueño?  177  !-Vive tu sueño!  ,He refused to discuss it and ordered him never to touch the subject again. But for 176 The question of tenacity: I'm catching up to my dream? 177! -Live your dream!
2239,78  esttellas parecian cantar de gozo. !-Si,78 Stones seemed to sing with joy. !-Yes
2240, libre! Libre segun las leyes del hombre y segun la sonrisa de Dios; !-y Dios bendiga a los que me ayudaron a serlo! 7  Aunque el dinero le habia sido dado como obsequio,free! Free according to the laws of man and according to the smile of God; ! -and God bless those who helped me to be! 7 Although the money had been given to him as a gift
2241, Keckly lo acepto unicamente como prestamo. Trabajo diligentemente por cinco años en San Luis y pago hasta el ultimo centavo.  UNA CARRERA MAS ALLA DE LA ESCLAVITUD  La libertad apenas era la mitad del sueño de Keckly,Keckly accepted it only as a loan. I work diligently for five years in San Luis and pay up to the last cent. A CAREER BEYOND SLAVE Freedom was barely half of Keckly's dream
2242, la otra mitad era llegar a ser una mujer de negocios de exito. Para lograrlo,the other half was to become a successful business woman. To make it
2243, se traslado primero a Baltimore y luego a Washington,moved first to Baltimore and then to Washington
2244, D.C.,D.C.
2245, donde empezo a trabajar como modista. Debido a su habilidad excepcional en la costura,where I started working as a dressmaker. Due to its exceptional ability in sewing
2246, su capacidad de entablar relaciones laborales y las magnifi- cas recomendaciones que recibio de sus clientes en San Luis,his capacity to establish labor relations and the magnificent recommendations he received from his clients in San Luis
2247, pronto logro obtener todo el trabajo que era capaz de atender. !-Estaba alcan- zando el triunfo! Rapidamente se gano el respeto de sus clientes y de los comerciantes locales,I soon obtained all the work I was capable of attending. ! -It was reaching the triumph! He quickly earned the respect of his clients and local merchants
2248, y obtuvo mucho exito. Entonces un sueño aun mas sublime se formo con claridad en su mente.   Desde que llegue a Washington  explica Keckly ,and he was very successful. Then a dream even more sublime was formed clearly in his mind. Since arriving in Washington explains Keckly
2249, tuve un gran deseo de trabajar para las damas de la Casa Blanca,I had a great desire to work for the ladies of the White House
2250, y para lograr esta meta estaba preparada para hacer casi cualquier sacrificio que fuera coherente con mi integridad . 8 No habia persona mas visible en Estados Unidos a quien confeccionarle sus vestidos. Ella continuo trabajando,and to achieve this goal I was prepared to make almost any sacrifice that was consistent with my integrity. 8 There was no more visible person in the United States to whom to make his clothes. She continued working
2251, aprovechando hasta lo sumo las referencias pasadas de boca en boca. En menos de un año logro su meta. Keckly se convirtio en la modista exclusiva,making the most of past references from mouth to mouth. In less than a year he achieved his goal. Keckly became the exclusive dressmaker
2252, consultora de modas y algunas  entonces el sueño era demasiado importante,fashion consultant and some then the dream was too important
2253, y ella no se daria por vencida. Ese mismo espiritu tenaz que la habia ayudado a sobrevivir las penalidades se enfoco en su deseo de comprar la libertad para ella y para su hijo.  Eso no me haria desistir  observo Kecldy ,and she would not give up. That same tenacious spirit that had helped her survive the hardships focused on her desire to buy freedom for herself and her son. That would not make me stop watching Kecldy
2254, porque la esperanza señalaba hacia una vida futura mas libre y mas brillante . 5 Una vez que toco el tema,because hope pointed to a freer and brighter future life. 5 Once I touch the subject
2255, su amo le ofrecio una moneda de plata y le dijo que tomara el ferry y cruzara el rio a Illinois,his master offered him a silver coin and told him to take the ferry and cross the river to Illinois
2256, un estado libre. Ella se nego.  Segun las leyes del pais soy su esclava; usted es mi amo  le dijo ,"a free state. She refused. According to the laws of the country, I am your slave; you are my master told him"
2257, y solamente buscare la libertad por los medios que las leyes de mi pais permiten. 6 Finalmente,and I will only seek freedom through the means that the laws of my country allow. 6 Finally
2258, cuando la situacion financiera de la familia se torno desesperante,when the financial situation of the family became desperate
2259, el amo fijo un precio: $1,the master fixed a price: $ 1
2260,200. Era un monto enorme,200. It was a huge amount
2261, probablemente hoy equivaldria a $25,probably today would be $ 25
2262,000. Sin embargo eso no detuvo a Kecldy. Sin importar el monto que hubiera fijado su amo,000. However that did not stop Kecldy. No matter how much your master would have set
2263, ella habria hallado una forma de pagarlo. Para una persona con su Tenacidad,she would have found a way to pay for it. For a person with his Tenacity
2264, ningun precio seria demasiado alto para lograr su sueño. Inicialmenre planeo viajar a Nueva York para pedirle a una orga- nizacion de caridad que le prestara el dinero. Pero para su sorpresa,No price would be too high to achieve your dream. Initially I plan to travel to New York to ask a charity to lend you the money. But to your surprise
2265, las mujeres a las cuales les habia confeccionado ropa vinieron en su auxilio,the women to whom he had made clothes came to his aid
2266, cada una de ellas aportando lo que podia. El 13 de noviembre de 1855,"each of them contributing what he could. November 13, 1855"
2267, Elizabeth Keckly compro la libertad para su hijo y para ella. En su autobiografia escribio:  Recaude los mil doscientos delates y al final mi hijo y yo eramos libres. !-Libres,Elizabeth Keckly bought freedom for her son and for her. In his autobiography he wrote: Collect the thousand two hundred taunts and in the end my son and I were free. ! -Books
2268, libres! !-Que glorioso sonido tiene esa palabra! !-Libre! La amarga lucha del corazon habia terminado. !-Libre! El alma podia subir al cielo y a Dios sin cadenas que estorbaran su vuelo ni que la detuvieran. !-Libre! La tierra se veia mas brillante y aun las mismas  La pregunta de la tenacidad:  Me estoy acercando a mi sueño ?  179  !-Vive tu sueño!  hombres son manojos de inicios.  Eres apenas uno que empieza,free! ! - What a glorious sound that word has! !-Free! The bitter struggle of the heart was over. !-Free! The soul could ascend to heaven and to God without chains that would impede its flight or stop it. !-Free! The earth looked brighter and even the same The question of tenacity: I'm getting closer to my dream? 179! -Live your dream! Men are bunches of beginnings. You are just one that starts
2269, o eres tambien uno que termina,or are you also one that ends
2270, como lo fue Keckly? Cuando se des- vanece el entusiasmo por una idea nueva,How was Keckly? When enthusiasm for a new idea vanishes
2271, cuando se enfria la pasion,when the passion is cold
2272, cuando las probabilidades en tu contra aumentan y los resultados disminuyen,when the odds against you increase and the results decrease
2273, cuando parece que el exito es imposible,when it seems that success is impossible
2274,  mantendras tu ahinco y seguiras adelante?  Eres tenaz? Ese es el distintivo de los que realmente logran su sueño.  La gran mayoria de los hombres  son manojos ele inicios.    .  RALPH WALDO EMERSON  Calvin Coolidge,Will you keep your energy and keep going? Are you tenacious? That is the hallmark of those who really achieve their dream. The vast majority of men are bundles of beginnings. . RALPH WALDO EMERSON Calvin Coolidge
2275, trigesimo presidente de Estados Unidos,Thirty President of the United States
2276," afirmo: Solo la persistencia y la detetminacion son omnipotentes. El lema ""sigue adelante"" ha resuelto y siempre resolvera los problemas de la raza humana. La tenacidad es la solucion a muchos de los proble- mas que encontraras en el camino de tus sueños. Considera el hecho de que el Almirante Roberr Peary intento llegar al Polo Norte siete veces antes de lograrlo. Osear Hammerstein produjo cinco especta- culos en Broadway que fueron fracasos antes de montat Oklahoma","I affirm: Only persistence and detemination are omnipotent. The motto ""keep going"" has solved and will always solve the problems of the human race. Tenacity is the solution to many of the problems you will find in the path of your dreams. Consider the fact that Admiral Roberr Peary tried to reach the North Pole seven times before achieving it. Oscar Hammerstein produced five Broadway shows that were failures before mounting Oklahoma"
2277, obra vista por mas de cuatro y medio millones de personas durante una tacha record de 2212 presentaciones. Thomas Edison fracaso en sus intentos de crear una bombilla luminosa practica diez mil veces antes de crear una que finalmente funcionara. Para lograr tus sueños,work seen by more than four and a half million people during a record strike of 2212 presentations. Thomas Edison failed in his attempts to create a light bulb practice ten thousand times before creating one that would eventually work. To achieve your dreams
2278, tendras que desarrollar la capacidad de seguir adelante cuando otros abandonan la lucha. !-Tendras que desarrollar tenacidad!  180  veces ayudante de camara de Mary Todd Lincoln,You will have to develop the ability to move forward when others leave the fight. ! -You will have to develop tenacity! 180 times Mary Todd Lincoln's camera assistant
2279, empezando un dia despues de la inauguracion de Abraham Lincoln. Ella tambien se convirtio en la amiga mas intima y confidente de la Sra. Lincoln. Keckly consolo a Lincoln cuando fallecio su hijo Willie; y luego del asesinato del presidente,starting one day after the inauguration of Abraham Lincoln. She also became the most intimate and confident friend of Mrs. Lincoln. Keckly consolo Lincoln when his son Willie passed away; and after the president's murder
2280, cuando le preguntaron:  Sra. Lincoln,when they asked: Mrs. Lincoln
2281,  hay alguna otra persona que desee que le acompañe en esta afliccion tan terrible?  la primera dama respondio : Si,Is there someone else who wants to accompany you in this terrible affliction? the first lady answered: Yes
2282, manda a buscar a Elizabeth Keckly .\'\' La Sra. Lincoln recibio mucho consuelo de ella. Años despues de la muerte del presidente,send for Elizabeth Keckly. \ '\' Mrs. Lincoln received much comfort from her. Years after the death of the president
2283," frecuentemente des- cribio a Keckly como su mejor amiga. 1"" El negocio de Keckly florecio en Washington. En una epoca llego a estar tan ocupada que abrio un segundo taller. En años posteriores","He often described Keckly as his best friend. 1 ""Keckly's business flourished in Washington, and at one time he became so busy that he opened a second workshop."
2284, se le conocio como maestra de costura. Logro todo lo que habia soñado,She was known as a sewing teacher. I achieve everything I had dreamed
2285, y mucho mas de lo que los demas estimaron que era capaz. Se deleito mucho en el hecho de que en los años que siguieron a la Guerra Civil,and much more than what others estimated he was capable of. He took great delight in the fact that in the years that followed the Civil War
2286, ella habia vivido mejor y estaba en mejor posicion financiera que los hijos de sus antiguos amos. 1 1 Si alguien le hubiera hecho la pregunta del costo   Estoy dispuesto a pagar el precio de mi sueño?  indudablemente que hubiera respondido con un si rotundo.   TE FORTALECE O TE DEBILITA TU SUEÑO?   Que de ti?  Como respondes a la pregunta de la tenacidad?  Te estas acercando a tu sueño?  Estas dando pasos al frenre?  Tienes tenacidad suficiente para perseverar? O,she had lived better and was in a better financial position than the children of her former masters. 1 1 If someone had asked the question of the cost I am willing to pay the price of my dream? Undoubtedly he would have answered with a resounding yes. WILL IT STRENGTHEN YOU OR DEBILITATE YOUR DREAM? What about you? How do you respond to the question of tenacity? Are you getting closer to your dream? Are you taking steps to the frenre? Do you have enough tenacity to persevere? OR
2287, cuando las cosas se pongan dificiles,when things get tough
2288, cosa que ciertamente sucedera,thing that will certainly happen
2289,  sera mas probable que te des por vencido? Ralph Waldo Emerson observo: La gran mayoria de los  La pregunta de la tenacidad:  Me estoy acercando a mi sueño?  Si  i Vive tu sueño!  f La mayoria de las personas se impiden a si mismas alcanzar su potencial.  Los que logran sus sueños no tienen un camino mas facil que los que no. Piensa en Elizabeth Keckly. Casi todo obraba en su contra,Will you be more likely to give up? Ralph Waldo Emerson observed: The vast majority of The question of tenacity: I am approaching my dream? If i live your dream! f Most people prevent themselves from reaching their potential. Those who achieve their dreams do not have a way easier than those who do not. Think of Elizabeth Keckly. Almost everything worked against him
2290, pero ella logro convertir sus sueños en realidad. No debemos crear excusas. En lugar de ello,but she managed to turn her dreams into reality. We must not create excuses. In stead of
2291, nuestra actitud debera ser como la del talentoso artista e inventor,our attitude should be like that of the talented artist and inventor
2292, Leonardo Da Vinci,Leonardo da Vinci
2293, quien dijo: Los obstaculos no pueden aplastarme. Cada obstaculo cede ante la reso- lucion firme. El que ha fijado su rumbo a una estrella no cambia de parecer. Hay que tener ese tipo de mentalidad para buscar un sueño tenazmente. La unica garantia para el fracaso es dejar de intentarlo. No existe barrera insalvable,who said: The obstacles can not crush me. Each obstacle gives way to firm resolution. He who has set his course to a star does not change his mind. You have to have that kind of mentality to pursue a dream tenaciously. The only guarantee for failure is to stop trying. There is no insurmountable barrier
2294, salvo nuestra inherente falta de persistencia.  La unica garantia del fracaso  li*. es dejar de intentarlo.  Existe una leyenda de un soldado que fue sometido a corte marcial ante Alejandro el Grande. Pensando que el veredicto era injusto,except our inherent lack of persistence. The only guarantee of failure li *. is to stop trying. There is a legend of a soldier who was subjected to court martial before Alexander the Great. Thinking that the verdict was unfair
2295, el soldado pidio apelarlo. El conquisrador le informo que no habia autoridad superior que el a quien pudiera apelar su caso.  En tal caso  respondio el soldado ,the soldier asked to appeal. The conquistador informed him that there was no higher authority than the one to whom he could appeal his case. In that case the soldier responded
2296, apelo mi causa de Alejandro el Pequeño a Alejandro el Grande.  Esa historia probablemente es apocrifa,I appeal my cause of Alexander the Little to Alexander the Great. That story is probably apocritical
2297, pero señala una verdad que debemos enfrentar. En cada uno de nosotros hay un ego menor  182  SIGUE LUCHANDO POR TU SUEÑO  El presidente Woodrow Wilson afirmo la importancia de los sueños: Crecemos por nuestros sueños. Todos los grandes individuos son soñadores. Ven cosas en la neblina suave de un dia de primavera,but it signals a truth that we must face. In each of us there is a lower ego 182 CONTINUE FIGHTING FOR YOUR DREAM President Woodrow Wilson affirmed the importance of dreams: We grow by our dreams. All the great individuals are dreamers. They see things in the soft haze of a spring day
2298, o en el fuego rojo de una larga noche de invierno. Algunos de nosotros permitirnos que esos magnificos sueños mueran,or in the red fire of a long winter night. Some of us allow those magnificent dreams to die
2299, pero otros los ali- mentan y protegen; los alimentan a traves de los dias malos hasta traerlos al sol y a la luz que siempre viene a los que sinceramente esperan que sus sueños se hagan realidad. Si quieres convertirte en alguien que alimenta un sueño hasta que se haga realidad,but others feed and protect them; They feed them through the bad days until they are brought to the sun and to the light that always comes to those who sincerely hope that their dreams come true. If you want to become someone who feeds a dream until it becomes a reality
2300, necesi- tas seguir trabajando,you need to keep working
2301, seguir esforzandote,continue to strive
2302, seguir acercandote a tu sueño. Para hacer eso,keep getting closer to your dream. To do that
2303, ten en mente lo siguiente:  1. PARA ACERCARTE A TU SUEÑO... RECONOCE QUE DARTE  POR VENCIDO TIENE QUE VER MAS CON QUIEN ERES QUE  CON DONDE TE ENCUENTRAS  Todos enfrenramos dificultades cuando trabajamos por alcanzar un sueño. Si alguien fracasa,keep in mind the following: 1. TO APPROACH YOUR DREAM ... YOU ACKNOWLEDGE THAT GIVING FORTHHELD HAS TO SEE MORE WITH WHOM YOU ARE WITH WHERE YOU FIND YOURSELF We all face difficulties when we work to achieve a dream. If someone fails
2304, podra dar excusas por lo que salio mal,could give excuses for what went wrong
2305, porque sucedio lo inesperado,because the unexpected happened
2306, porque alguien le decepciono,because someone disappointed him
2307, porque las circunstancias obraron en su contra. Pero la realidad es que las cosas externas no detienen a la gente,because the circumstances worked against him. But the reality is that external things do not stop people
2308, es lo que les sucede en su interior. La mayoria de las personas se impiden a si mismas alcanzar su potencial. Pueden pretender que otras personas,it is what happens inside them. Most people prevent themselves from reaching their potential. They can pretend that other people
2309, cosas y situacio- nes ajenas a si mismos son las responsables por sus fracasos,things and situations alien to themselves are responsible for their failures
2310, pero en realidad,but actually
2311, lo son ellos.  La pregunta de la tenacidad:  Me estoy acercando a mi sueño?  183  !-Vive tu sueño!  Nuestro yo mayor dice: He ido demasiado lejos para darme por vencido ahora.  El escritor H. E. Jensen debio haber escuchado a su yo mayor cuando dijo: El hombre que gana pudo haber sido declarado fuera de combate varias veces,they are. The question of tenacity: I'm getting closer to my dream? 183! -Live your dream! Our older self says: I've gone too far to give up now. The writer H. E. Jensen should have listened to his older self when he said: The man who wins could have been declared out of combat several times
2312, pero nunca escucho al arbitro.  Nuestro yo menor dice: No tienes la fuerza para aferrarle a tu sueño. Nuestro yo mayor dice: Resiste un poco mas; la hora mas tenebrosa es justo antes del alba.  La novelista Harriet Beecher Stowe obedecio a su yo mayor y dijo: Cuando estes en un lugar estrecho y todo parezca estar en tu contra,but I never hear the referee. Our youngest self says: You do not have the strength to hold on to your dream. Our older self says: Resist a little more; the darkest hour is just before dawn. The novelist Harriet Beecher Stowe obeyed her older self and said: When you are in a narrow place and everything seems to be against you
2313, hasta el punto que pareciera que no puedes soportarlo ni un minuro mas,to the point that it seems that you can not stand it nor a minuro more
2314, no te des por vencido aun,do not give up even
2315, porque ese es justo el momento y el lugar en que la marea cambiara.  ;<El hombre que gana pudo haber sido declarado fuera de  combate vanas veces,because that is just the time and the place where the tide will change. <The man who wins may have been declared out of action many times
2316, pero nunca escucho al arbitro.   H. E.JENSEN  Asi que cuando las cosas van mal,but I never hear the referee. H. E.JENSEN So when things go wrong
2317, cuando los obstaculos parecen demasiado grandes,when the obstacles seem too big
2318, cuando las dificultades parecen ser demasiadas,when the difficulties seem to be too many
2319, cuando tu sueño parece estar imposiblemente lejos,when your dream seems to be impossibly far
2320, tu tarea consiste sencillamente en seguir adelante. Si te detienes,your task is simply to move on. If you stop
2321, no sera por lo que sucede a tu alrededor; sino por lo que sucede dentro de ti. El exito  184  y un ego mayor que luchan por la supremacia. El menor nos lleva a la derrota,it will not be because of what happens around you; but for what happens inside you. Success 184 and a greater ego struggling for supremacy. The minor leads us to defeat
